{"call_evidence":"unknown","consumed":{"model_attempts":6,"node_entries":10,"repair_rounds":0},"effective_policy_refs":[{"content_digest":"sha256:5a56b4647c195a78bc7a7d3d277d8c79c4428a36ea9ca0be084bd2d9f2ff938e","policy_id":"agent.assignment.task-gate","version":"2"},{"content_digest":"sha256:7fde2701d491dd7e101e8080f52a0d469178e18712ebcd1bf438895244ad12f7","policy_id":"selection","version":"selection/1"},{"content_digest":"sha256:f9609767f94c3dcde6b35f307aef41b348bf74112830cd4be475f9764591ba03","policy_id":"assignment.host-facts","version":"1"}],"error_code":null,"evidence_summary_ref":null,"exhausted_dimension":null,"failure_stage":null,"flow_ref":{"content_digest":"sha256:349a4a789aebc60b24779e7c60963e6e2e6422118f8d5d87615a5d1941e87739","flow_id":"agent.assignment.alternate","version":"1"},"outcome":{"disposition":"ready","issues":[],"proposals":[{"basis_observation_ids":["controlled-observation"],"payload":{"action":"create","configuration":{"ratio":0.7},"configuration_kind":"controlled.new.kind"},"preconditions":[{"checker_id":"task_revision","checker_version":"1","condition_id":"task_revision","description":"","expected_digest":null,"expected_version":"1","kind":"task_revision","requirement":"must","subject_ref":{"identity":{"id":"offline-task","revision":"1"},"source_namespace":"task"}},{"checker_id":"identity","checker_version":"1","condition_id":"identity","description":"","expected_digest":null,"expected_version":"1","kind":"identity","requirement":"must","subject_ref":{"identity":{"id":"unit-1","revision":"1"},"source_namespace":"controlled-unit"}},{"checker_id":"version","checker_version":"1","condition_id":"version","description":"","expected_digest":null,"expected_version":"1","kind":"version","requirement":"must","subject_ref":{"identity":{"id":"unit-1","revision":"1"},"source_namespace":"controlled-unit"}},{"checker_id":"permission","checker_version":"1","condition_id":"permission","description":"","expected_digest":null,"expected_version":"1","kind":"permission","requirement":"must","subject_ref":{"identity":{"id":"unit-1","revision":"1"},"source_namespace":"controlled-unit"}},{"checker_id":"scope","checker_version":"1","condition_id":"scope","description":"","expected_digest":null,"expected_version":"1","kind":"scope","requirement":"must","subject_ref":{"identity":{"id":"unit-1","revision":"1"},"source_namespace":"controlled-unit"}},{"checker_id":"fixed_profile","checker_version":"1","condition_id":"fixed_profile","description":"","expected_digest":null,"expected_version":"1","kind":"fixed_profile","requirement":"must","subject_ref":{"identity":{"id":"unit-1","revision":"1"},"source_namespace":"controlled-unit"}},{"checker_id":"fixed_harness","checker_version":"1","condition_id":"fixed_harness","description":"","expected_digest":null,"expected_version":"1","kind":"fixed_harness","requirement":"must","subject_ref":{"identity":{"id":"unit-1","revision":"1"},"source_namespace":"controlled-unit"}},{"checker_id":"directory","checker_version":"1","condition_id":"directory","description":"","expected_digest":null,"expected_version":"1","kind":"directory","requirement":"must","subject_ref":{"identity":{"id":"unit-1","revision":"1"},"source_namespace":"controlled-unit"}},{"checker_id":"resources","checker_version":"1","condition_id":"resources","description":"","expected_digest":null,"expected_version":"1","kind":"resources","requirement":"must","subject_ref":{"identity":{"id":"unit-1","revision":"1"},"source_namespace":"controlled-unit"}},{"checker_id":"installation","checker_version":"1","condition_id":"installation","description":"","expected_digest":null,"expected_version":"1","kind":"installation","requirement":"must","subject_ref":{"identity":{"id":"unit-1","revision":"1"},"source_namespace":"controlled-unit"}},{"checker_id":"public_read_assessment","checker_version":"1","condition_id":"public_read_assessment","description":"","expected_digest":null,"expected_version":"1","kind":"public_read_assessment","requirement":"must","subject_ref":{"identity":{"id":"unit-1","revision":"1"},"source_namespace":"controlled-unit"}}],"proposal_id":"offline-proposal","proposal_kind":"agent.assignment/1","rationale_codes":[],"required_validation_obligations":[{"obligation_id":"configuration","requirement":"must","subject_ref":{"identity":{"id":"unit-1","revision":"1"},"source_namespace":"controlled-unit"},"validator_kind":"owner.read","version_constraint":"1"}]}],"receipts":[{"checked_at":"2026-10-05T09:19:04.891659+00:00","issues":[],"obligation_results":[{"checker_id":"owner.read","checker_version":"1","evidence_refs":["controlled-offline-evidence"],"exemption_policy_ref":null,"obligation_id":"configuration","source_versions":{"descriptor":"1"},"status":"passed"}],"proposal_digest":"sha256:54fc9062c1f097a9a6d45311c528d35e5d449f4623f59cc155001cafe6e3b57e","status":"valid","validated_observation_versions":{},"validation_scope":"controlled_offline_only","validator_id":"offline","validator_version":"1"}]},"request_id":"offline-request","run_id":"c1de7876-e984-42d4-8c05-3e3e64fbe7ab","run_manifest_digest":"sha256:92e3eedbc71ea45d79dc8c1093a8c5a29a7eff61a0ecd3e0844ae7eb05d910d9","status":"completed","task_revision":"1"}
