{"call_evidence":"unknown","consumed":{"model_attempts":6,"node_entries":10,"repair_rounds":0},"effective_policy_refs":[{"content_digest":"sha256:5a56b4647c195a78bc7a7d3d277d8c79c4428a36ea9ca0be084bd2d9f2ff938e","policy_id":"agent.assignment.task-gate","version":"2"},{"content_digest":"sha256:7fde2701d491dd7e101e8080f52a0d469178e18712ebcd1bf438895244ad12f7","policy_id":"selection","version":"selection/1"},{"content_digest":"sha256:f9609767f94c3dcde6b35f307aef41b348bf74112830cd4be475f9764591ba03","policy_id":"assignment.host-facts","version":"1"}],"error_code":null,"evidence_summary_ref":null,"exhausted_dimension":null,"failure_stage":null,"flow_ref":{"content_digest":"sha256:14467b3de65904a5bb31f5951a00f6be74d7053867d74d6684d73570afe9dc07","flow_id":"agent.assignment","version":"1"},"outcome":{"disposition":"ready","issues":[],"proposals":[{"basis_observation_ids":["controlled-observation"],"payload":{"action":"continue","configuration":{"ratio":0.7},"configuration_kind":"controlled.new.kind"},"preconditions":[{"checker_id":"task_revision","checker_version":"1","condition_id":"task_revision","description":"","expected_digest":null,"expected_version":"1","kind":"task_revision","requirement":"must","subject_ref":{"identity":{"id":"offline-task","revision":"1"},"source_namespace":"task"}},{"checker_id":"identity","checker_version":"1","condition_id":"identity","description":"","expected_digest":null,"expected_version":"1","kind":"identity","requirement":"must","subject_ref":{"identity":{"id":"unit-1","revision":"1"},"source_namespace":"controlled-unit"}},{"checker_id":"version","checker_version":"1","condition_id":"version","description":"","expected_digest":null,"expected_version":"1","kind":"version","requirement":"must","subject_ref":{"identity":{"id":"unit-1","revision":"1"},"source_namespace":"controlled-unit"}},{"checker_id":"permission","checker_version":"1","condition_id":"permission","description":"","expected_digest":null,"expected_version":"1","kind":"permission","requirement":"must","subject_ref":{"identity":{"id":"unit-1","revision":"1"},"source_namespace":"controlled-unit"}},{"checker_id":"scope","checker_version":"1","condition_id":"scope","description":"","expected_digest":null,"expected_version":"1","kind":"scope","requirement":"must","subject_ref":{"identity":{"id":"unit-1","revision":"1"},"source_namespace":"controlled-unit"}},{"checker_id":"same_native_context","checker_version":"1","condition_id":"same_native_context","description":"","expected_digest":null,"expected_version":"1","kind":"same_native_context","requirement":"must","subject_ref":{"identity":{"id":"unit-1","revision":"1"},"source_namespace":"controlled-unit"}},{"checker_id":"availability","checker_version":"1","condition_id":"availability","description":"","expected_digest":null,"expected_version":"1","kind":"availability","requirement":"must","subject_ref":{"identity":{"id":"unit-1","revision":"1"},"source_namespace":"controlled-unit"}}],"proposal_id":"offline-proposal","proposal_kind":"agent.assignment/1","rationale_codes":[],"required_validation_obligations":[{"obligation_id":"configuration","requirement":"must","subject_ref":{"identity":{"id":"unit-1","revision":"1"},"source_namespace":"controlled-unit"},"validator_kind":"owner.read","version_constraint":"1"}]}],"receipts":[{"checked_at":"2026-10-05T09:19:04.713731+00:00","issues":[],"obligation_results":[{"checker_id":"owner.read","checker_version":"1","evidence_refs":["controlled-offline-evidence"],"exemption_policy_ref":null,"obligation_id":"configuration","source_versions":{"descriptor":"1"},"status":"passed"}],"proposal_digest":"sha256:44521fcd3dedffbf86e8bdfcdebe6bf2e6742a95bc6116c2a0e7802cf4fee82c","status":"valid","validated_observation_versions":{},"validation_scope":"controlled_offline_only","validator_id":"offline","validator_version":"1"}]},"request_id":"offline-request","run_id":"3829a923-cc69-410b-be80-89fceae1e6ae","run_manifest_digest":"sha256:971ac3be91318297043e46b0b352205bb2a9b944079ffe043253a1a1dea960c9","status":"completed","task_revision":"1"}
